<?xml version="1.0" encoding="UTF-8"?>
<?xml-stylesheet type="text/xsl" href="xsl/Dataformat.xsl"?>
<!--
This document holds additional meta-information that is not part of an actual shape file to be processed 
in the context of the BO's ENE project. 
Author: Christian Danowski, Benno Schmidt, Department of Geodesy, Bochum University of Applied Sciences.
-->
<DatasetDescription version="0.1" xsi:noNamespaceSchemaLocation="xsd/DatasetDescription.xsd" xmlns:xsi="http://www.w3.org/2001/XMLSchema-instance">
	<SpatialScaleHint>India</SpatialScaleHint>
	<CovereredTime/>
	<DatasetReference>IndiaTreeCover2013.xml</DatasetReference><!-- Dateiname-->
	<SourceFileReference/>
	<Source>
		<ContactPersons>Dr. Ashok A. Sonkusare</ContactPersons><!-- Kontaktpersonen betreffend der abgegriffenen Informationen-->
		<URI accessDate="2015-10-20 +12:00">https://data.gov.in/catalog/stateut-wise-tree-cover-estimates</URI><!-- Datum des Zugriffes sowie deren Quelle-->
		<AlternativeURIs><!--The follwing URI links to the website where the direct download link from above is from.-->
			<URI>https://data.gov.in/node/123108/datastore/export/csv</URI><!--The following URI represents the direkt download link to the shape file-->
		</AlternativeURIs>
		<Notes>Bie diesem Datensatz handelt es sich um die mit Bäumen bedeckte Fläche der indischen States.</Notes>
	</Source>
	<CopyrightInformation>Dr. Ashok A. Sonkusare - https://data.gov.in/</CopyrightInformation><!-- Copyright Informationen-->
	<ImportProcess>
		<Description language="DE"><!-- Erklaerung der Arbeitsabfolge-->
	   		Die Datei kann direkt in verschiedenen Formaten (hier CSV) heruntergeladen werden. 
			Anschließend muss die Datei umbenannt werden (hier: India_TreeCover2013.csv).
			
			Die in der CSV-Datei enthaltenen Parameter konnten mittels eines eigens entwickelten Java-Programms in den 'Entry'-Abschnitt der "IndiaTreeCover2013.xml"-Datei überführt werden.	   		
	   	</Description>
	</ImportProcess>
</DatasetDescription>
