<?xml version="1.0" encoding="UTF-8"?>
<?xml-stylesheet type="text/xsl" href="xsl/Dataformat.xsl"?>
<!--
Author: Matthias Schmiedel, Department of Geodesy, Bochum University of Applied Sciences.
-->
<DatasetDescription version="0.1" xsi:noNamespaceSchemaLocation="xsd/DatasetDescription.xsd" xmlns:xsi="http://www.w3.org/2001/XMLSchema-instance">
	<SpatialScaleHint>World-wide</SpatialScaleHint>
	<CovereredTime>
		<TimePeriod>
			<begin>2008-01-01+01:00</begin><!-- Daten beziehen sich auf das Jahr 2008-->
			<end> 2008-01-01+01:00</end>
		</TimePeriod>
	</CovereredTime>
	<DatasetReference>ElectricityProductionFromSpecificRessource.xml</DatasetReference><!-- Dateiname des Datensatzes der Erzeugung von Elektrezietät-->
	<SourceFileReference format="XLSX">sourceFiles/ElectricityProductionFromSpecificRessource.xlsx</SourceFileReference>
	<Source>
		<ContactPersons/>
		<URI accessDate="2014-05-14 +11:00">http://www.iea.org/statistics/statisticssearch/report/?country=GERMANY&amp;product=electricityandheat&amp;year=2008</URI>
		<AlternativeURIs><!-- Here additional URLs can be documented. -->
			<URI/>
		</AlternativeURIs>
		<Notes/>
	</Source>
	<CopyrightInformation>unknown</CopyrightInformation>
	<ImportProcess>
		<Description language="DE">
		Nachfolgende Änderung bzw. Ergänzung der Einzelnen Spalten um den Identifikator der Länderkürzel anhand der  ISO 3166 Alpha-2 
		zu finden unter: http://de.wikipedia.org/wiki/ISO-3166-1-Kodierliste
		Die nun erarbeiteten Daten, müssen nun in eine .csv Datei umgewandelt werden, welche durch den Identifier des Ländercodes zugeordnet werden können um in die XML Struktur
		überführt zu werden
	   	</Description>
		<QualityCheck date="09.06.2014 +22:00" responsiblePerson="Matthias Schmiedel">
	   		Ergänzung des Metadatensatzes bezüglich der Herstellung von Elektrizität.
	   	</QualityCheck>
	</ImportProcess>
</DatasetDescription>
