<?xml version="1.0" encoding="UTF-8"?>
<?xml-stylesheet type="text/xsl" href="xsl/Dataformat.xsl"?>
<!--
This example shows how to hold additional meta-information that is not part of an actual data file to be processed 
in the context of the BO's ENE project. 
Primarly, meta-data which document the underlying data-source should be given
 in such DatasetDescriptions.
Authors: Benno Schmidt, Christian Danowski, Department of Geodesy, Bochum University of Applied Sciences.
-->
<DatasetDescription version="0.1" xsi:noNamespaceSchemaLocation="xsd/DatasetDescription.xsd" xmlns:xsi="http://www.w3.org/2001/XMLSchema-instance">
	<SpatialScaleHint>World-wide</SpatialScaleHint><!-- 
	For the GI-project "Gespraech mit der Erde", this scale hint always will be "World-wide". In the future, regional data will
	be processed, so that other values might appear. 
	-->
	<CovereredTime>
		<TimePeriod>
			<begin>2000-01-01+01:00</begin>
			<end>2010-12-31+01:00</end>
		</TimePeriod>
	</CovereredTime>
	<DatasetReference>Population.xml</DatasetReference>
	<SourceFileReference format="CSV">UNEP-EDE__pop_total__1398251955.csv</SourceFileReference>
	<Source>
		<ContactPersons/>
		<URI accessDate="2014-04-23 +11:00">http://geodata.grid.unep.ch/</URI>
		<AlternativeURIs><!-- Here additional URLs can be documented. -->
			<URI/>
		</AlternativeURIs>
		<Notes/>
	</Source>
	<CopyrightInformation>UNEP - United Nations Environment Programme; European Commission, Joint Research Centre (JRC)/PBL Netherlands Environmental Assessment Agency.</CopyrightInformation>
	<ImportProcess>
		<Description language="DE">
	   		Von obiger URL (siehe 'URI'-Tag) wurde der Datensatz 'Population - Total both Sexes' als CSV-Datei bezogen. 
			Die ersten vier Zeilen der CSV-Datei enthalten Metadaten wie Titel, Einheit und URL. Diese Zeilen mueessen beim Auslesen der Datei geskipped werden. Erst in Zeile fueenf befinden sich die Spaltenueeberschriften.
	   		Die CSV-Datei wurde schlie√ülich genutzt, um ueeber ein eigens entwickeltes Java-Programm den 'Entries'-Abschnitt der 'Population.xml'-Datei (siehe 'DatasetReference'-Tag) zu erstellen.
	   		Die weiteren Informationen der 'Population.xml'-Datei wurden per Hand eingetragen.
			
			Nachtrag vom 03.06.2014:
	   		Der Datensatz fueer "Antarctic" musste manuell angepasst werden. In der Source-File waren ISO3166-Alpha2 und ISO3166-Alpha3-Codes vertauscht! Daher musste in der XML-Datei der ENE:CountryCode von 'ATA' zu 'AQ' gesetzt werden.
	   	</Description>
		<QualityCheck date="2014-04-28 +09:00" responsiblePerson="Christian Danowski">
	   		Datensaetze aus generiertem XML-Dokument stichprobenhaft von Hand mit Tabelle im Web verglichen.
	   	</QualityCheck>
	</ImportProcess>
</DatasetDescription>
