<?xml version="1.0" encoding="UTF-8"?>
<?xml-stylesheet type="text/xsl" href="xsl/Dataformat.xsl"?>
<!--
This example shows how to hold additional meta-information that is not part of an actual data file to be processed 
in the context of the BO's ENE project. 
Primarly, meta-data which document the underlying data-source should be given
 in such DatasetDescriptions.

Author: Benno Schmidt, Department of Geodesy, Bochum University of Applied Sciences.
-->
<DatasetDescription version="0.1" xmlns:xsi="http://www.w3.org/2001/XMLSchema-instance" xsi:noNamespaceSchemaLocation="xsd/DatasetDescription.xsd">
	<SpatialScaleHint>World-wide</SpatialScaleHint>
 <!-- Weltweite abdeckung-->
	<!-- 
	For the GI-project "Gespr채ch mit der Erde", this scale hint always will be "World-wide". In the future, regional data will
	be processed, so that other values might appear. 
	--> 
	<CovereredTime />
	<DatasetReference>EarthAtNight.xml</DatasetReference>
 <!-- Dateiname-->
	<SourceFileReference />
	<Source>
		<ContactPersons />
		<URI accessDate="2014-03-12 +11:00">http://www.nasa.gov/mission_pages/NPP/news/earth-at-night.html</URI>
 <!-- Zeitangabe sowie Quelle der abgegriffenen Daten-->
		<AlternativeURIs />
		<Notes>Images with higher resolution are available on the Web.</Notes>
 <!-- Bemerkungen-->
	</Source>
	<CopyrightInformation>NASA Earth Observatory/NOAA NGDC</CopyrightInformation>
 <!-- Copyright Informationen-->
	<ImportProcess>
		<Description language="DE">
 <!-- Erkl채rung der Arbeitsschritte-->
	   		Das Image l채sst sich problemlos aus dem Web herunterladen. Zu beachten ist, dass die Pixel sich auf das
	   		lon/lat-Koordinatensystem der Erde beziehen m체ssen!
	   	</Description>
	</ImportProcess>
</DatasetDescription>
