<?xml version="1.0" encoding="UTF-8"?>
<?xml-stylesheet type="text/xsl" href="xsl/Dataformat.xsl"?>
<!--
This example shows how to hold additional meta-information that is not part of an actual data file to be processed 
in the context of the BO's ENE project. 
Primarly, meta-data which document the underlying data-source should be given
 in such DatasetDescriptions.

Author: Benno Schmidt, Department of Geodesy, Bochum University of Applied Sciences.
-->
<DatasetDescription version="0.1" xmlns:xsi="http://www.w3.org/2001/XMLSchema-instance" xsi:noNamespaceSchemaLocation="xsd/DatasetDescription.xsd">
	<SpatialScaleHint>World-wide</SpatialScaleHint>
 <!-- Weltweite abdeckung-->
	<!-- 
	For the GI-project "Gespraech mit der Erde", this scale hint always will be "World-wide". In the future, regional data will
	be processed, so that other values might appear. 
	--> 
	<CovereredTime />
	<DatasetReference>EarthTimeLapseViewfromSpace.xml</DatasetReference>
 <!-- Dateiname-->
	<SourceFileReference />
	<Source>
		<ContactPersons />
		<URI accessDate="2014-10-06 +08:40">https://archive.org/details/EarthTimeLapseViewfromSpace</URI>
 <!-- Zeitangabe sowie Quelle der abgegriffenen Daten-->
		<AlternativeURIs />
		<Notes>On the website, scroll down to find some download links to the video.</Notes>
 <!-- Bemerkungen-->
	</Source>
	<CopyrightInformation>Jeff Kaplan, kaplan@archive.org; Music: Jan Jelinek</CopyrightInformation>
 <!-- Copyright Informationen-->
	<ImportProcess>
		<Description language="DE">
 <!-- Erklaerung der Arbeitsschritte-->
	   		Direkt auf der Webseite kann man nach unten scrollen und dort downloads des Videos finden.
	   	</Description>
	</ImportProcess>
</DatasetDescription>
